{
  "schema_version": "1.1.0",
  "objective_id": "obj-20260712T214352Z",
  "run_id": "run-20260712T214352Z",
  "branch_id": "main",
  "pass_id": "pass-0002",
  "objective": "build mythos report human window over a run",
  "evidence": [
    {
      "id": "ev-objective",
      "kind": "objective",
      "summary": "build mythos report human window over a run",
      "source_ids": [
        "raw:objective.md"
      ],
      "observed_at": "2026-07-12T21:43:52.404Z"
    },
    {
      "id": "ev-subagent-session-20260712T215254Z-report-builder",
      "kind": "subagent-session",
      "summary": "Captured quarantined subagent output for lane report-builder; machine records were extracted without Prime synthesis.",
      "source_ids": [
        "raw:subagents/report-builder.md"
      ],
      "source_refs": [
        {
          "source_id": "raw:subagents/report-builder.md",
          "path": "raw/subagents/report-builder.md",
          "kind": "raw",
          "hash": "7073d8b33ec6c088",
          "hash_alg": "fnv1a-64",
          "span": null,
          "observed_at": "2026-07-12T21:52:54.296Z"
        }
      ],
      "observed_at": "2026-07-12T21:52:54.296Z",
      "agent_id": "report-builder-1",
      "lane": "report-builder"
    },
    {
      "id": "ev-auto-report-builder-1",
      "kind": "observation",
      "summary": "pub fn html_escape(s: &str) -> String escapes & < > \" ' by replacing them with &amp; &lt; &gt; &quot; &#39;",
      "source_ids": [
        "raw:subagents/report-builder.md",
        "file:mythos-compiler/src/compiler/report.rs:35"
      ],
      "source_refs": [
        {
          "source_id": "file:mythos-compiler/src/compiler/report.rs:35",
          "path": "mythos-compiler/src/compiler/report.rs",
          "kind": "file",
          "hash": "58a3e1b0fedaf8b6",
          "hash_alg": "fnv1a-64",
          "hash_basis": "content",
          "span": "35",
          "observed_at": "2026-07-12T21:52:54.296Z"
        }
      ],
      "observed_at": "2026-07-12T21:52:54.296Z",
      "agent_id": "report-builder-1",
      "lane": "report-builder"
    },
    {
      "id": "ev-auto-report-builder-2",
      "kind": "observation",
      "summary": "pub struct GateReport deserializes {ok, errors, warnings} with serde defaults, tolerating missing/extra fields",
      "source_ids": [
        "raw:subagents/report-builder.md",
        "file:mythos-compiler/src/compiler/report.rs:22"
      ],
      "source_refs": [
        {
          "source_id": "file:mythos-compiler/src/compiler/report.rs:22",
          "path": "mythos-compiler/src/compiler/report.rs",
          "kind": "file",
          "hash": "58a3e1b0fedaf8b6",
          "hash_alg": "fnv1a-64",
          "hash_basis": "content",
          "span": "22",
          "observed_at": "2026-07-12T21:52:54.296Z"
        }
      ],
      "observed_at": "2026-07-12T21:52:54.296Z",
      "agent_id": "report-builder-1",
      "lane": "report-builder"
    },
    {
      "id": "ev-auto-report-builder-3",
      "kind": "observation",
      "summary": "pub fn render_report(packet, receipts, gate) -> String is the pure, unit-testable renderer with no system-time calls",
      "source_ids": [
        "raw:subagents/report-builder.md",
        "file:mythos-compiler/src/compiler/report.rs:408"
      ],
      "source_refs": [
        {
          "source_id": "file:mythos-compiler/src/compiler/report.rs:408",
          "path": "mythos-compiler/src/compiler/report.rs",
          "kind": "file",
          "hash": "58a3e1b0fedaf8b6",
          "hash_alg": "fnv1a-64",
          "hash_basis": "content",
          "span": "408",
          "observed_at": "2026-07-12T21:52:54.296Z"
        }
      ],
      "observed_at": "2026-07-12T21:52:54.296Z",
      "agent_id": "report-builder-1",
      "lane": "report-builder"
    },
    {
      "id": "ev-auto-report-builder-4",
      "kind": "observation",
      "summary": "pub fn generate_report(run_dir) loads next_pass_packet.json + verified receipts + optional gate-report.json and writes state/report.html",
      "source_ids": [
        "raw:subagents/report-builder.md",
        "file:mythos-compiler/src/compiler/report.rs:439"
      ],
      "source_refs": [
        {
          "source_id": "file:mythos-compiler/src/compiler/report.rs:439",
          "path": "mythos-compiler/src/compiler/report.rs",
          "kind": "file",
          "hash": "58a3e1b0fedaf8b6",
          "hash_alg": "fnv1a-64",
          "hash_basis": "content",
          "span": "439",
          "observed_at": "2026-07-12T21:52:54.296Z"
        }
      ],
      "observed_at": "2026-07-12T21:52:54.296Z",
      "agent_id": "report-builder-1",
      "lane": "report-builder"
    },
    {
      "id": "ev-auto-report-builder-5",
      "kind": "observation",
      "summary": "compiler/mod.rs registers the new module with pub mod report;",
      "source_ids": [
        "raw:subagents/report-builder.md",
        "file:mythos-compiler/src/compiler/mod.rs:9"
      ],
      "source_refs": [
        {
          "source_id": "file:mythos-compiler/src/compiler/mod.rs:9",
          "path": "mythos-compiler/src/compiler/mod.rs",
          "kind": "file",
          "hash": "1ff777d0f12d6359",
          "hash_alg": "fnv1a-64",
          "hash_basis": "content",
          "span": "9",
          "observed_at": "2026-07-12T21:52:54.296Z"
        }
      ],
      "observed_at": "2026-07-12T21:52:54.296Z",
      "agent_id": "report-builder-1",
      "lane": "report-builder"
    },
    {
      "id": "ev-auto-report-builder-6",
      "kind": "observation",
      "summary": "bin/mythos.rs imports generate_report from the new module",
      "source_ids": [
        "raw:subagents/report-builder.md",
        "file:mythos-compiler/src/bin/mythos.rs:2"
      ],
      "source_refs": [
        {
          "source_id": "file:mythos-compiler/src/bin/mythos.rs:2",
          "path": "mythos-compiler/src/bin/mythos.rs",
          "kind": "file",
          "hash": "46a3b267a438d8fe",
          "hash_alg": "fnv1a-64",
          "hash_basis": "content",
          "span": "2",
          "observed_at": "2026-07-12T21:52:54.296Z"
        }
      ],
      "observed_at": "2026-07-12T21:52:54.296Z",
      "agent_id": "report-builder-1",
      "lane": "report-builder"
    },
    {
      "id": "ev-auto-report-builder-7",
      "kind": "observation",
      "summary": "bin/mythos.rs adds a \"report\" command arm that parses --run-dir via parse_run_dir, preflights the run dir, calls generate_report, and prints the output path",
      "source_ids": [
        "raw:subagents/report-builder.md",
        "file:mythos-compiler/src/bin/mythos.rs:63"
      ],
      "source_refs": [
        {
          "source_id": "file:mythos-compiler/src/bin/mythos.rs:63",
          "path": "mythos-compiler/src/bin/mythos.rs",
          "kind": "file",
          "hash": "46a3b267a438d8fe",
          "hash_alg": "fnv1a-64",
          "hash_basis": "content",
          "span": "63",
          "observed_at": "2026-07-12T21:52:54.296Z"
        }
      ],
      "observed_at": "2026-07-12T21:52:54.296Z",
      "agent_id": "report-builder-1",
      "lane": "report-builder"
    },
    {
      "id": "ev-auto-report-builder-8",
      "kind": "observation",
      "summary": "bin/mythos.rs help text gains one line documenting `report --run-dir <dir>`",
      "source_ids": [
        "raw:subagents/report-builder.md",
        "file:mythos-compiler/src/bin/mythos.rs:87"
      ],
      "source_refs": [
        {
          "source_id": "file:mythos-compiler/src/bin/mythos.rs:87",
          "path": "mythos-compiler/src/bin/mythos.rs",
          "kind": "file",
          "hash": "46a3b267a438d8fe",
          "hash_alg": "fnv1a-64",
          "hash_basis": "content",
          "span": "87",
          "observed_at": "2026-07-12T21:52:54.296Z"
        }
      ],
      "observed_at": "2026-07-12T21:52:54.296Z",
      "agent_id": "report-builder-1",
      "lane": "report-builder"
    },
    {
      "id": "ev-auto-report-builder-9",
      "kind": "observation",
      "summary": "Five new unit tests added: html_escape (all 5 chars), XSS-in-summary escaping, con:receipt:* renders in refutations panel, receipt row shows exit code + label, coverage math 2 attested + 1 verifier + 1 asserted = 50% attested",
      "source_ids": [
        "raw:subagents/report-builder.md",
        "file:mythos-compiler/src/compiler/report.rs:562",
        "file:mythos-compiler/src/compiler/report.rs:567",
        "file:mythos-compiler/src/compiler/report.rs:586",
        "file:mythos-compiler/src/compiler/report.rs:605",
        "file:mythos-compiler/src/compiler/report.rs:616"
      ],
      "source_refs": [
        {
          "source_id": "file:mythos-compiler/src/compiler/report.rs:562",
          "path": "mythos-compiler/src/compiler/report.rs",
          "kind": "file",
          "hash": "58a3e1b0fedaf8b6",
          "hash_alg": "fnv1a-64",
          "hash_basis": "content",
          "span": "562",
          "observed_at": "2026-07-12T21:52:54.296Z"
        },
        {
          "source_id": "file:mythos-compiler/src/compiler/report.rs:567",
          "path": "mythos-compiler/src/compiler/report.rs",
          "kind": "file",
          "hash": "58a3e1b0fedaf8b6",
          "hash_alg": "fnv1a-64",
          "hash_basis": "content",
          "span": "567",
          "observed_at": "2026-07-12T21:52:54.296Z"
        },
        {
          "source_id": "file:mythos-compiler/src/compiler/report.rs:586",
          "path": "mythos-compiler/src/compiler/report.rs",
          "kind": "file",
          "hash": "58a3e1b0fedaf8b6",
          "hash_alg": "fnv1a-64",
          "hash_basis": "content",
          "span": "586",
          "observed_at": "2026-07-12T21:52:54.296Z"
        },
        {
          "source_id": "file:mythos-compiler/src/compiler/report.rs:605",
          "path": "mythos-compiler/src/compiler/report.rs",
          "kind": "file",